[
  {
    "Campaign": "mb | DK | Search | Brand",
    "Ad Group": "Brand | Danmark",
    "Headline 1": "Adam & Eva Flytteservice",
    "Headline 1 position": 1,
    "Headline 2": "Flytning med kærlig hånd",
    "Headline 2 position": 2,
    "Headline 3": "Lokalt flyttefirma på Sjælland",
    "Headline 3 position": "",
    "Headline 4": "Fast pris på din flytning",
    "Headline 4 position": "",
    "Headline 5": "Erfarne flyttemænd",
    "Headline 5 position": "",
    "Headline 6": "Sikker transport og opbevaring",
    "Headline 6 position": "",
    "Headline 7": "Ring og book i dag",
    "Headline 7 position": "",
    "Headline 8": "Vi klarer pakning og montage",
    "Headline 8 position": "",
    "Headline 9": "Hurtigt svar på tilbud",
    "Headline 9 position": "",
    "Headline 10": "Forsikret fra start til slut",
    "Headline 10 position": "",
    "Headline 11": "Kørsel i hele Sjælland",
    "Headline 11 position": "",
    "Headline 12": "",
    "Headline 12 position": "",
    "Headline 13": "",
    "Headline 13 position": "",
    "Headline 14": "",
    "Headline 14 position": "",
    "Headline 15": "",
    "Headline 15 position": "",
    "Description 1": "Din lokale partner til privat og erhverv. Få et fast tilbud i dag.",
    "Description 1 position": "",
    "Description 2": "Flytning med kærlig hånd, erfarne folk og forsikret transport.",
    "Description 2 position": "",
    "Description 3": "Vi pakker, bærer og monterer så du slipper for besværet.",
    "Description 3 position": "",
    "Description 4": "Book et gratis tilbud – vi svarer hurtigt og præcist.",
    "Description 4 position": "",
    "Path 1": "flytning",
    "Path 2": "sjælland",
    "Final URL": "https://aeflyt.dk/"
  },
  {
    "Campaign": "mb | DK | Search | Privat",
    "Ad Group": "Flyttefirma | Sjælland",
    "Headline 1": "{KeyWord:Flyttefirma Sjælland}",
    "Headline 1 position": 1,
    "Headline 2": "I {LOCATION(City):din by}",
    "Headline 2 position": 2,
    "Headline 3": "Flytning med kærlig hånd",
    "Headline 3 position": "",
    "Headline 4": "Få fast pris i dag",
    "Headline 4 position": "",
    "Headline 5": "Erfarne flyttemænd på Sjælland",
    "Headline 5 position": "",
    "Headline 6": "Pakkeservice og forsikring",
    "Headline 6 position": "",
    "Headline 7": "Hurtig opstart også weekend",
    "Headline 7 position": "",
    "Headline 8": "Vi bærer, pakker og monterer",
    "Headline 8 position": "",
    "Headline 9": "Uforpligtende flyttetilbud nu",
    "Headline 9 position": "",
    "Headline 10": "Tryg flytning hver gang",
    "Headline 10 position": "",
    "Headline 11": "Vi kører i hele Sjælland",
    "Headline 11 position": "",
    "Headline 12": "",
    "Headline 12 position": "",
    "Headline 13": "",
    "Headline 13 position": "",
    "Headline 14": "",
    "Headline 14 position": "",
    "Headline 15": "",
    "Headline 15 position": "",
    "Description 1": "Book en tryg flytning i {LOCATION(City):din by}. Vi pakker og kører sikkert.",
    "Description 1 position": "",
    "Description 2": "Få fast pris og uforpligtende tilbud i dag. Erfarne flyttemænd klar.",
    "Description 2 position": "",
    "Description 3": "Vi håndterer nedpakning, transport og montage med kærlig hånd.",
    "Description 3 position": "",
    "Description 4": "Lokalt team på Sjælland – fleksible tider og forsikret flytning.",
    "Description 4 position": "",
    "Path 1": "flytte",
    "Path 2": "tilbud",
    "Final URL": "https://aeflyt.dk/flytning/"
  },
  {
    "Campaign": "mb | DK | Search | Privat",
    "Ad Group": "Pris & Tilbud | Sjælland",
    "Headline 1": "{KeyWord:Pris på flytning}",
    "Headline 1 position": 1,
    "Headline 2": "Få tilbud i dag",
    "Headline 2 position": 2,
    "Headline 3": "Fast pris uden skjulte gebyrer",
    "Headline 3 position": "",
    "Headline 4": "Gratis og hurtigt tilbud",
    "Headline 4 position": "",
    "Headline 5": "Sammenlign pris og kvalitet",
    "Headline 5 position": "",
    "Headline 6": "Fleksible tider også weekend",
    "Headline 6 position": "",
    "Headline 7": "Forsikring inkl. i prisen",
    "Headline 7 position": "",
    "Headline 8": "Vi kører i hele Sjælland",
    "Headline 8 position": "",
    "Headline 9": "Ring og få pris på 5 min",
    "Headline 9 position": "",
    "Headline 10": "Lokalt team på Sjælland",
    "Headline 10 position": "",
    "Headline 11": "Kærlige hænder på dine møbler",
    "Headline 11 position": "",
    "Headline 12": "",
    "Headline 12 position": "",
    "Headline 13": "",
    "Headline 13 position": "",
    "Headline 14": "",
    "Headline 14 position": "",
    "Headline 15": "",
    "Headline 15 position": "",
    "Description 1": "Få et hurtigt prisoverslag på din flytning. Fast pris og ingen overraskelser.",
    "Description 1 position": "",
    "Description 2": "Vi tilbyder fair priser og forsikret transport i hele Sjælland.",
    "Description 2 position": "",
    "Description 3": "Skriv eller ring – vi giver tilbud med det samme.",
    "Description 3 position": "",
    "Description 4": "Book tid nu og få ro i maven om din flytning.",
    "Description 4 position": "",
    "Path 1": "pris",
    "Path 2": "flyt",
    "Final URL": "https://aeflyt.dk/flytning/"
  },
  {
    "Campaign": "mb | DK | Search | Erhverv",
    "Ad Group": "Erhvervsflytning | Sjælland",
    "Headline 1": "{KeyWord:Erhvervsflytning}",
    "Headline 1 position": 1,
    "Headline 2": "Minimér nedetid",
    "Headline 2 position": 2,
    "Headline 3": "Weekend-kontorflytning",
    "Headline 3 position": "",
    "Headline 4": "Projektleder på opgaven",
    "Headline 4 position": "",
    "Headline 5": "IT-udstyr håndteret sikkert",
    "Headline 5 position": "",
    "Headline 6": "Fast tidsplan og fast pris",
    "Headline 6 position": "",
    "Headline 7": "Erfarne teams på Sjælland",
    "Headline 7 position": "",
    "Headline 8": "Forsikret fra A til B",
    "Headline 8 position": "",
    "Headline 9": "Flyt mens I arbejder videre",
    "Headline 9 position": "",
    "Headline 10": "Specialister i erhverv",
    "Headline 10 position": "",
    "Headline 11": "Uforpligtende tilbud i dag",
    "Headline 11 position": "",
    "Headline 12": "",
    "Headline 12 position": "",
    "Headline 13": "",
    "Headline 13 position": "",
    "Headline 14": "",
    "Headline 14 position": "",
    "Headline 15": "",
    "Headline 15 position": "",
    "Description 1": "Flyt virksomhed uden driftstop. Vi planlægger alt og leverer til tiden.",
    "Description 1 position": "",
    "Description 2": "Projektleder, tjeklister og forsikring sikrer en tryg erhvervsflytning.",
    "Description 2 position": "",
    "Description 3": "Weekend- og aftenflytning så medarbejdere kan arbejde videre.",
    "Description 3 position": "",
    "Description 4": "Få et fast tilbud og tidsplan for jeres kontor- eller lagerflytning.",
    "Description 4 position": "",
    "Path 1": "erhverv",
    "Path 2": "sjælland",
    "Final URL": "https://aeflyt.dk/erhvervsflytning/"
  },
  {
    "Campaign": "mb | DK | Search | Erhverv",
    "Ad Group": "Kontorflytning | Sjælland",
    "Headline 1": "{KeyWord:Kontorflytning}",
    "Headline 1 position": 1,
    "Headline 2": "Planlagt i {LOCATION(City):by}",
    "Headline 2 position": 2,
    "Headline 3": "IT og arbejdspladser sikkert",
    "Headline 3 position": "",
    "Headline 4": "Montering og kabelhåndtering",
    "Headline 4 position": "",
    "Headline 5": "Flyt uden at stoppe driften",
    "Headline 5 position": "",
    "Headline 6": "Erfaren projektleder på sagen",
    "Headline 6 position": "",
    "Headline 7": "Fast pris og klar tidsplan",
    "Headline 7 position": "",
    "Headline 8": "Weekend- og aftenflytning",
    "Headline 8 position": "",
    "Headline 9": "Kontorer på Sjælland",
    "Headline 9 position": "",
    "Headline 10": "Forsikret transport og løft",
    "Headline 10 position": "",
    "Headline 11": "Book et møde i dag",
    "Headline 11 position": "",
    "Headline 12": "",
    "Headline 12 position": "",
    "Headline 13": "",
    "Headline 13 position": "",
    "Headline 14": "",
    "Headline 14 position": "",
    "Headline 15": "",
    "Headline 15 position": "",
    "Description 1": "Kontorflytning med minimal nedetid. Vi håndterer it, møbler og kabler.",
    "Description 1 position": "",
    "Description 2": "Planlagt flytning med projektleder, tjeklister og forsikring inkluderet.",
    "Description 2 position": "",
    "Description 3": "Vi flytter gerne aften/ weekend så jeres drift kører videre.",
    "Description 3 position": "",
    "Description 4": "Kontakt os for et fast tilbud på kontorflytning i {LOCATION(City):din by}.",
    "Description 4 position": "",
    "Path 1": "kontor",
    "Path 2": "flyt",
    "Final URL": "https://aeflyt.dk/erhvervsflytning/"
  },
  {
    "Campaign": "mb | DK | Search | Opbevaring",
    "Ad Group": "Opbevaring | Sjælland",
    "Headline 1": "{KeyWord:Møbelopbevaring}",
    "Headline 1 position": 1,
    "Headline 2": "Tørt og sikkert lager",
    "Headline 2 position": 2,
    "Headline 3": "Afhentning og levering",
    "Headline 3 position": "",
    "Headline 4": "Fleksibel kort og lang leje",
    "Headline 4 position": "",
    "Headline 5": "Forsikret opbevaring af møbler",
    "Headline 5 position": "",
    "Headline 6": "Container og lagerhotel",
    "Headline 6 position": "",
    "Headline 7": "Vi pakker og bærer for dig",
    "Headline 7 position": "",
    "Headline 8": "Fast pris på opbevaring",
    "Headline 8 position": "",
    "Headline 9": "Kombinér flytning+opbevaring",
    "Headline 9 position": "",
    "Headline 10": "Overvåget lager adgang",
    "Headline 10 position": "",
    "Headline 11": "",
    "Headline 11 position": "",
    "Headline 12": "",
    "Headline 12 position": "",
    "Headline 13": "",
    "Headline 13 position": "",
    "Headline 14": "",
    "Headline 14 position": "",
    "Headline 15": "",
    "Headline 15 position": "",